No.     Time           Source                Destination           Protocol Length Info
    246 35.959183499   141.22.27.100         141.22.27.10          SMB2     138    KeepAlive Request

Frame 246: 138 bytes on wire (1104 bits), 138 bytes captured (1104 bits) on interface 0
Ethernet II, Src: Dell_d7:8b:2a (98:90:96:d7:8b:2a), Dst: Ibm_74:5e:58 (40:f2:e9:74:5e:58)
    Destination: Ibm_74:5e:58 (40:f2:e9:74:5e:58)
    Source: Dell_d7:8b:2a (98:90:96:d7:8b:2a)
    Type: IPv4 (0x0800)
Internet Protocol Version 4, Src: 141.22.27.100, Dst: 141.22.27.10
    0100 .... = Version: 4
    .... 0101 = Header Length: 20 bytes (5)
    Differentiated Services Field: 0x00 (DSCP: CS0, ECN: Not-ECT)
    Total Length: 124
    Identification: 0xb19c (45468)
    Flags: 0x4000, Don't fragment
    Time to live: 64
    Protocol: TCP (6)
    Header checksum: 0x3845 [validation disabled]
    [Header checksum status: Unverified]
    Source: 141.22.27.100
    Destination: 141.22.27.10
Transmission Control Protocol, Src Port: 34930, Dst Port: 445, Seq: 1, Ack: 1, Len: 72
NetBIOS Session Service
SMB2 (Server Message Block Protocol version 2)

No.     Time           Source                Destination           Protocol Length Info
    248 35.959410452   141.22.27.100         141.22.27.10          TCP      66     34930 → 445 [ACK] Seq=73 Ack=73 Win=1128 Len=0 TSval=3972057587 TSecr=632841732

Frame 248: 66 bytes on wire (528 bits), 66 bytes captured (528 bits) on interface 0
Ethernet II, Src: Dell_d7:8b:2a (98:90:96:d7:8b:2a), Dst: Ibm_74:5e:58 (40:f2:e9:74:5e:58)
    Destination: Ibm_74:5e:58 (40:f2:e9:74:5e:58)
    Source: Dell_d7:8b:2a (98:90:96:d7:8b:2a)
    Type: IPv4 (0x0800)
Internet Protocol Version 4, Src: 141.22.27.100, Dst: 141.22.27.10
    0100 .... = Version: 4
    .... 0101 = Header Length: 20 bytes (5)
    Differentiated Services Field: 0x00 (DSCP: CS0, ECN: Not-ECT)
    Total Length: 52
    Identification: 0xb19d (45469)
    Flags: 0x4000, Don't fragment
    Time to live: 64
    Protocol: TCP (6)
    Header checksum: 0x388c [validation disabled]
    [Header checksum status: Unverified]
    Source: 141.22.27.100
    Destination: 141.22.27.10
Transmission Control Protocol, Src Port: 34930, Dst Port: 445, Seq: 73, Ack: 73, Len: 0

No.     Time           Source                Destination           Protocol Length Info
    610 74.947668784   141.22.27.100         172.217.19.68         IPv4     34     

Frame 610: 34 bytes on wire (272 bits), 34 bytes captured (272 bits) on interface 0
Ethernet II, Src: Dell_d7:8b:2a (98:90:96:d7:8b:2a), Dst: Cisco_ae:b4:00 (6c:50:4d:ae:b4:00)
    Destination: Cisco_ae:b4:00 (6c:50:4d:ae:b4:00)
    Source: Dell_d7:8b:2a (98:90:96:d7:8b:2a)
    Type: IPv4 (0x0800)
Internet Protocol Version 4, Src: 141.22.27.100, Dst: 172.217.19.68
    0100 .... = Version: 4
    .... 0101 = Header Length: 20 bytes (5)
    Differentiated Services Field: 0x00 (DSCP: CS0, ECN: Not-ECT)
    Total Length: 20
    Identification: 0x0001 (1)
    Flags: 0x0000
    Time to live: 64
    Protocol: IPv6 Hop-by-Hop Option (0)
    Header checksum: 0x1252 [validation disabled]
    [Header checksum status: Unverified]
    Source: 141.22.27.100
    Destination: 172.217.19.68

No.     Time           Source                Destination           Protocol Length Info
    619 75.751477885   141.22.27.100         141.22.26.1           NTP      90     NTP Version 4, client

Frame 619: 90 bytes on wire (720 bits), 90 bytes captured (720 bits) on interface 0
Ethernet II, Src: Dell_d7:8b:2a (98:90:96:d7:8b:2a), Dst: Cisco_ae:b4:00 (6c:50:4d:ae:b4:00)
    Destination: Cisco_ae:b4:00 (6c:50:4d:ae:b4:00)
    Source: Dell_d7:8b:2a (98:90:96:d7:8b:2a)
    Type: IPv4 (0x0800)
Internet Protocol Version 4, Src: 141.22.27.100, Dst: 141.22.26.1
    0100 .... = Version: 4
    .... 0101 = Header Length: 20 bytes (5)
    Differentiated Services Field: 0xb8 (DSCP: EF PHB, ECN: Not-ECT)
    Total Length: 76
    Identification: 0x790c (30988)
    Flags: 0x4000, Don't fragment
    Time to live: 64
    Protocol: UDP (17)
    Header checksum: 0x714b [validation disabled]
    [Header checksum status: Unverified]
    Source: 141.22.27.100
    Destination: 141.22.26.1
User Datagram Protocol, Src Port: 123, Dst Port: 123
Network Time Protocol (NTP Version 4, client)

No.     Time           Source                Destination           Protocol Length Info
    781 97.399193742   141.22.27.100         141.22.27.10          SMB2     138    KeepAlive Request

Frame 781: 138 bytes on wire (1104 bits), 138 bytes captured (1104 bits) on interface 0
Ethernet II, Src: Dell_d7:8b:2a (98:90:96:d7:8b:2a), Dst: Ibm_74:5e:58 (40:f2:e9:74:5e:58)
    Destination: Ibm_74:5e:58 (40:f2:e9:74:5e:58)
    Source: Dell_d7:8b:2a (98:90:96:d7:8b:2a)
    Type: IPv4 (0x0800)
Internet Protocol Version 4, Src: 141.22.27.100, Dst: 141.22.27.10
    0100 .... = Version: 4
    .... 0101 = Header Length: 20 bytes (5)
    Differentiated Services Field: 0x00 (DSCP: CS0, ECN: Not-ECT)
    Total Length: 124
    Identification: 0xb19e (45470)
    Flags: 0x4000, Don't fragment
    Time to live: 64
    Protocol: TCP (6)
    Header checksum: 0x3843 [validation disabled]
    [Header checksum status: Unverified]
    Source: 141.22.27.100
    Destination: 141.22.27.10
Transmission Control Protocol, Src Port: 34930, Dst Port: 445, Seq: 73, Ack: 73, Len: 72
NetBIOS Session Service
SMB2 (Server Message Block Protocol version 2)

No.     Time           Source                Destination           Protocol Length Info
    783 97.399444947   141.22.27.100         141.22.27.10          TCP      66     34930 → 445 [ACK] Seq=145 Ack=145 Win=1128 Len=0 TSval=3972119026 TSecr=632903173

Frame 783: 66 bytes on wire (528 bits), 66 bytes captured (528 bits) on interface 0
Ethernet II, Src: Dell_d7:8b:2a (98:90:96:d7:8b:2a), Dst: Ibm_74:5e:58 (40:f2:e9:74:5e:58)
    Destination: Ibm_74:5e:58 (40:f2:e9:74:5e:58)
    Source: Dell_d7:8b:2a (98:90:96:d7:8b:2a)
    Type: IPv4 (0x0800)
Internet Protocol Version 4, Src: 141.22.27.100, Dst: 141.22.27.10
    0100 .... = Version: 4
    .... 0101 = Header Length: 20 bytes (5)
    Differentiated Services Field: 0x00 (DSCP: CS0, ECN: Not-ECT)
    Total Length: 52
    Identification: 0xb19f (45471)
    Flags: 0x4000, Don't fragment
    Time to live: 64
    Protocol: TCP (6)
    Header checksum: 0x388a [validation disabled]
    [Header checksum status: Unverified]
    Source: 141.22.27.100
    Destination: 141.22.27.10
Transmission Control Protocol, Src Port: 34930, Dst Port: 445, Seq: 145, Ack: 145, Len: 0
