No.     Time           Source                Destination           Protocol Length Info
    122 9.409138455    141.22.27.100         172.217.19.68         TCP      54     20 → 80 [SYN] Seq=0 Win=8192 Len=0

Frame 122: 54 bytes on wire (432 bits), 54 bytes captured (432 bits) on interface 0
Ethernet II, Src: Dell_d7:8b:2a (98:90:96:d7:8b:2a), Dst: Cisco_ae:b4:00 (6c:50:4d:ae:b4:00)
Internet Protocol Version 4, Src: 141.22.27.100, Dst: 172.217.19.68
Transmission Control Protocol, Src Port: 20, Dst Port: 80, Seq: 0, Len: 0
    Source Port: 20
    Destination Port: 80
    [Stream index: 1]
    [TCP Segment Len: 0]
    Sequence number: 0    (relative sequence number)
    [Next sequence number: 0    (relative sequence number)]
    Acknowledgment number: 0
    0101 .... = Header Length: 20 bytes (5)
    Flags: 0x002 (SYN)
    Window size value: 8192
    [Calculated window size: 8192]
    Checksum: 0x26e7 [unverified]
    [Checksum Status: Unverified]
    Urgent pointer: 0
    [Timestamps]

No.     Time           Source                Destination           Protocol Length Info
    212 19.260542057   141.22.27.100         141.22.27.10          SMB2     138    KeepAlive Request

Frame 212: 138 bytes on wire (1104 bits), 138 bytes captured (1104 bits) on interface 0
Ethernet II, Src: Dell_d7:8b:2a (98:90:96:d7:8b:2a), Dst: Ibm_74:5e:58 (40:f2:e9:74:5e:58)
Internet Protocol Version 4, Src: 141.22.27.100, Dst: 141.22.27.10
Transmission Control Protocol, Src Port: 35176, Dst Port: 445, Seq: 1, Ack: 1, Len: 72
    Source Port: 35176
    Destination Port: 445
    [Stream index: 4]
    [TCP Segment Len: 72]
    Sequence number: 1    (relative sequence number)
    [Next sequence number: 73    (relative sequence number)]
    Acknowledgment number: 1    (relative ack number)
    1000 .... = Header Length: 32 bytes (8)
    Flags: 0x018 (PSH, ACK)
    Window size value: 262
    [Calculated window size: 262]
    [Window size scaling factor: -1 (unknown)]
    Checksum: 0x5109 [unverified]
    [Checksum Status: Unverified]
    Urgent pointer: 0
    Options: (12 bytes), No-Operation (NOP), No-Operation (NOP), Timestamps
    [SEQ/ACK analysis]
        [Bytes in flight: 72]
        [Bytes sent since last PSH flag: 72]
    [Timestamps]
    TCP payload (72 bytes)
NetBIOS Session Service
SMB2 (Server Message Block Protocol version 2)

No.     Time           Source                Destination           Protocol Length Info
    214 19.265179628   141.22.27.100         141.22.27.10          TCP      66     35176 → 445 [ACK] Seq=73 Ack=73 Win=262 Len=0 TSval=3972917734 TSecr=633701897

Frame 214: 66 bytes on wire (528 bits), 66 bytes captured (528 bits) on interface 0
Ethernet II, Src: Dell_d7:8b:2a (98:90:96:d7:8b:2a), Dst: Ibm_74:5e:58 (40:f2:e9:74:5e:58)
Internet Protocol Version 4, Src: 141.22.27.100, Dst: 141.22.27.10
Transmission Control Protocol, Src Port: 35176, Dst Port: 445, Seq: 73, Ack: 73, Len: 0
    Source Port: 35176
    Destination Port: 445
    [Stream index: 4]
    [TCP Segment Len: 0]
    Sequence number: 73    (relative sequence number)
    [Next sequence number: 73    (relative sequence number)]
    Acknowledgment number: 73    (relative ack number)
    1000 .... = Header Length: 32 bytes (8)
    Flags: 0x010 (ACK)
    Window size value: 262
    [Calculated window size: 262]
    [Window size scaling factor: -1 (unknown)]
    Checksum: 0x50c1 [unverified]
    [Checksum Status: Unverified]
    Urgent pointer: 0
    Options: (12 bytes), No-Operation (NOP), No-Operation (NOP), Timestamps
    [SEQ/ACK analysis]
        [This is an ACK to the segment in frame: 213]
        [The RTT to ACK the segment was: 0.000027911 seconds]
    [Timestamps]
