No.     Time           Source                Destination           Protocol Length Info
    198 18.071610885   141.22.27.100         141.22.28.254         TCP      54     20 → 80 [SYN] Seq=0 Win=8192 Len=0

Frame 198: 54 bytes on wire (432 bits), 54 bytes captured (432 bits) on interface 0
Ethernet II, Src: Dell_d7:8b:2a (98:90:96:d7:8b:2a), Dst: Cisco_ae:b4:00 (6c:50:4d:ae:b4:00)
Internet Protocol Version 4, Src: 141.22.27.100, Dst: 141.22.28.254
Transmission Control Protocol, Src Port: 20, Dst Port: 80, Seq: 0, Len: 0
    Source Port: 20
    Destination Port: 80
    [Stream index: 3]
    [TCP Segment Len: 0]
    Sequence number: 0    (relative sequence number)
    [Next sequence number: 0    (relative sequence number)]
    Acknowledgment number: 0
    0101 .... = Header Length: 20 bytes (5)
    Flags: 0x002 (SYN)
    Window size value: 8192
    [Calculated window size: 8192]
    Checksum: 0x2c66 [unverified]
    [Checksum Status: Unverified]
    Urgent pointer: 0
    [Timestamps]

No.     Time           Source                Destination           Protocol Length Info
    199 18.071902680   141.22.28.254         141.22.27.100         TCP      60     80 → 20 [SYN, ACK] Seq=0 Ack=1 Win=29200 Len=0 MSS=1460

Frame 199: 60 bytes on wire (480 bits), 60 bytes captured (480 bits) on interface 0
Ethernet II, Src: Cisco_ae:b4:00 (6c:50:4d:ae:b4:00), Dst: Dell_d7:8b:2a (98:90:96:d7:8b:2a)
Internet Protocol Version 4, Src: 141.22.28.254, Dst: 141.22.27.100
Transmission Control Protocol, Src Port: 80, Dst Port: 20, Seq: 0, Ack: 1, Len: 0
    Source Port: 80
    Destination Port: 20
    [Stream index: 3]
    [TCP Segment Len: 0]
    Sequence number: 0    (relative sequence number)
    [Next sequence number: 0    (relative sequence number)]
    Acknowledgment number: 1    (relative ack number)
    0110 .... = Header Length: 24 bytes (6)
    Flags: 0x012 (SYN, ACK)
    Window size value: 29200
    [Calculated window size: 29200]
    Checksum: 0xcedd [unverified]
    [Checksum Status: Unverified]
    Urgent pointer: 0
    Options: (4 bytes), Maximum segment size
    [SEQ/ACK analysis]
        [This is an ACK to the segment in frame: 198]
        [The RTT to ACK the segment was: 0.000291795 seconds]
        [iRTT: 23.228919655 seconds]
    [Timestamps]

No.     Time           Source                Destination           Protocol Length Info
    230 19.340621263   141.22.28.254         141.22.27.100         TCP      60     [TCP Retransmission] 80 → 20 [SYN, ACK] Seq=0 Ack=1 Win=29200 Len=0 MSS=1460

Frame 230: 60 bytes on wire (480 bits), 60 bytes captured (480 bits) on interface 0
Ethernet II, Src: Cisco_ae:b4:00 (6c:50:4d:ae:b4:00), Dst: Dell_d7:8b:2a (98:90:96:d7:8b:2a)
Internet Protocol Version 4, Src: 141.22.28.254, Dst: 141.22.27.100
Transmission Control Protocol, Src Port: 80, Dst Port: 20, Seq: 0, Ack: 1, Len: 0
    Source Port: 80
    Destination Port: 20
    [Stream index: 3]
    [TCP Segment Len: 0]
    Sequence number: 0    (relative sequence number)
    [Next sequence number: 0    (relative sequence number)]
    Acknowledgment number: 1    (relative ack number)
    0110 .... = Header Length: 24 bytes (6)
    Flags: 0x012 (SYN, ACK)
    Window size value: 29200
    [Calculated window size: 29200]
    Checksum: 0xcedd [unverified]
    [Checksum Status: Unverified]
    Urgent pointer: 0
    Options: (4 bytes), Maximum segment size
    [SEQ/ACK analysis]
        [iRTT: 23.228919655 seconds]
        [TCP Analysis Flags]
            [Expert Info (Note/Sequence): This frame is a (suspected) retransmission]
            [The RTO for this segment was: 1.268718583 seconds]
            [RTO based on delta from frame: 199]
    [Timestamps]

No.     Time           Source                Destination           Protocol Length Info
    248 21.540617697   141.22.28.254         141.22.27.100         TCP      60     [TCP Retransmission] 80 → 20 [SYN, ACK] Seq=0 Ack=1 Win=29200 Len=0 MSS=1460

Frame 248: 60 bytes on wire (480 bits), 60 bytes captured (480 bits) on interface 0
Ethernet II, Src: Cisco_ae:b4:00 (6c:50:4d:ae:b4:00), Dst: Dell_d7:8b:2a (98:90:96:d7:8b:2a)
Internet Protocol Version 4, Src: 141.22.28.254, Dst: 141.22.27.100
Transmission Control Protocol, Src Port: 80, Dst Port: 20, Seq: 0, Ack: 1, Len: 0
    Source Port: 80
    Destination Port: 20
    [Stream index: 3]
    [TCP Segment Len: 0]
    Sequence number: 0    (relative sequence number)
    [Next sequence number: 0    (relative sequence number)]
    Acknowledgment number: 1    (relative ack number)
    0110 .... = Header Length: 24 bytes (6)
    Flags: 0x012 (SYN, ACK)
    Window size value: 29200
    [Calculated window size: 29200]
    Checksum: 0xcedd [unverified]
    [Checksum Status: Unverified]
    Urgent pointer: 0
    Options: (4 bytes), Maximum segment size
    [SEQ/ACK analysis]
        [iRTT: 23.228919655 seconds]
        [TCP Analysis Flags]
            [Expert Info (Note/Sequence): This frame is a (suspected) retransmission]
            [The RTO for this segment was: 3.468715017 seconds]
            [RTO based on delta from frame: 199]
    [Timestamps]

No.     Time           Source                Destination           Protocol Length Info
    281 25.540609904   141.22.28.254         141.22.27.100         TCP      60     [TCP Retransmission] 80 → 20 [SYN, ACK] Seq=0 Ack=1 Win=29200 Len=0 MSS=1460

Frame 281: 60 bytes on wire (480 bits), 60 bytes captured (480 bits) on interface 0
Ethernet II, Src: Cisco_ae:b4:00 (6c:50:4d:ae:b4:00), Dst: Dell_d7:8b:2a (98:90:96:d7:8b:2a)
Internet Protocol Version 4, Src: 141.22.28.254, Dst: 141.22.27.100
Transmission Control Protocol, Src Port: 80, Dst Port: 20, Seq: 0, Ack: 1, Len: 0
    Source Port: 80
    Destination Port: 20
    [Stream index: 3]
    [TCP Segment Len: 0]
    Sequence number: 0    (relative sequence number)
    [Next sequence number: 0    (relative sequence number)]
    Acknowledgment number: 1    (relative ack number)
    0110 .... = Header Length: 24 bytes (6)
    Flags: 0x012 (SYN, ACK)
    Window size value: 29200
    [Calculated window size: 29200]
    Checksum: 0xcedd [unverified]
    [Checksum Status: Unverified]
    Urgent pointer: 0
    Options: (4 bytes), Maximum segment size
    [SEQ/ACK analysis]
        [iRTT: 23.228919655 seconds]
        [TCP Analysis Flags]
            [Expert Info (Note/Sequence): This frame is a (suspected) retransmission]
            [The RTO for this segment was: 7.468707224 seconds]
            [RTO based on delta from frame: 199]
    [Timestamps]

No.     Time           Source                Destination           Protocol Length Info
    336 33.540570241   141.22.28.254         141.22.27.100         TCP      60     [TCP Retransmission] 80 → 20 [SYN, ACK] Seq=0 Ack=1 Win=29200 Len=0 MSS=1460

Frame 336: 60 bytes on wire (480 bits), 60 bytes captured (480 bits) on interface 0
Ethernet II, Src: Cisco_ae:b4:00 (6c:50:4d:ae:b4:00), Dst: Dell_d7:8b:2a (98:90:96:d7:8b:2a)
Internet Protocol Version 4, Src: 141.22.28.254, Dst: 141.22.27.100
Transmission Control Protocol, Src Port: 80, Dst Port: 20, Seq: 0, Ack: 1, Len: 0
    Source Port: 80
    Destination Port: 20
    [Stream index: 3]
    [TCP Segment Len: 0]
    Sequence number: 0    (relative sequence number)
    [Next sequence number: 0    (relative sequence number)]
    Acknowledgment number: 1    (relative ack number)
    0110 .... = Header Length: 24 bytes (6)
    Flags: 0x012 (SYN, ACK)
    Window size value: 29200
    [Calculated window size: 29200]
    Checksum: 0xcedd [unverified]
    [Checksum Status: Unverified]
    Urgent pointer: 0
    Options: (4 bytes), Maximum segment size
    [SEQ/ACK analysis]
        [iRTT: 23.228919655 seconds]
        [TCP Analysis Flags]
            [Expert Info (Note/Sequence): This frame is a (suspected) retransmission]
            [The RTO for this segment was: 15.468667561 seconds]
            [RTO based on delta from frame: 199]
    [Timestamps]

No.     Time           Source                Destination           Protocol Length Info
    394 41.300530540   141.22.27.100         141.22.28.254         HTTP     70     GET / HTTP/1.0 

Frame 394: 70 bytes on wire (560 bits), 70 bytes captured (560 bits) on interface 0
Ethernet II, Src: Dell_d7:8b:2a (98:90:96:d7:8b:2a), Dst: Cisco_ae:b4:00 (6c:50:4d:ae:b4:00)
Internet Protocol Version 4, Src: 141.22.27.100, Dst: 141.22.28.254
Transmission Control Protocol, Src Port: 20, Dst Port: 80, Seq: 1, Ack: 1, Len: 16
    Source Port: 20
    Destination Port: 80
    [Stream index: 3]
    [TCP Segment Len: 16]
    Sequence number: 1    (relative sequence number)
    [Next sequence number: 17    (relative sequence number)]
    Acknowledgment number: 1    (relative ack number)
    0101 .... = Header Length: 20 bytes (5)
    Flags: 0x010 (ACK)
    Window size value: 8192
    [Calculated window size: 8192]
    [Window size scaling factor: -2 (no window scaling used)]
    Checksum: 0x6a05 [unverified]
    [Checksum Status: Unverified]
    Urgent pointer: 0
    [SEQ/ACK analysis]
        [This is an ACK to the segment in frame: 199]
        [The RTT to ACK the segment was: 23.228627860 seconds]
        [iRTT: 23.228919655 seconds]
        [Bytes in flight: 16]
        [Bytes sent since last PSH flag: 16]
    [Timestamps]
    TCP payload (16 bytes)
Hypertext Transfer Protocol

No.     Time           Source                Destination           Protocol Length Info
    395 41.300805549   141.22.28.254         141.22.27.100         TCP      60     80 → 20 [ACK] Seq=1 Ack=17 Win=29200 Len=0

Frame 395: 60 bytes on wire (480 bits), 60 bytes captured (480 bits) on interface 0
Ethernet II, Src: Cisco_ae:b4:00 (6c:50:4d:ae:b4:00), Dst: Dell_d7:8b:2a (98:90:96:d7:8b:2a)
Internet Protocol Version 4, Src: 141.22.28.254, Dst: 141.22.27.100
Transmission Control Protocol, Src Port: 80, Dst Port: 20, Seq: 1, Ack: 17, Len: 0
    Source Port: 80
    Destination Port: 20
    [Stream index: 3]
    [TCP Segment Len: 0]
    Sequence number: 1    (relative sequence number)
    [Next sequence number: 1    (relative sequence number)]
    Acknowledgment number: 17    (relative ack number)
    0101 .... = Header Length: 20 bytes (5)
    Flags: 0x010 (ACK)
    Window size value: 29200
    [Calculated window size: 29200]
    [Window size scaling factor: -2 (no window scaling used)]
    Checksum: 0xe68a [unverified]
    [Checksum Status: Unverified]
    Urgent pointer: 0
    [SEQ/ACK analysis]
        [This is an ACK to the segment in frame: 394]
        [The RTT to ACK the segment was: 0.000275009 seconds]
        [iRTT: 23.228919655 seconds]
    [Timestamps]

No.     Time           Source                Destination           Protocol Length Info
    396 41.301072280   141.22.28.254         141.22.27.100         HTTP     534    HTTP/1.1 400 Bad Request  (text/html)

Frame 396: 534 bytes on wire (4272 bits), 534 bytes captured (4272 bits) on interface 0
Ethernet II, Src: Cisco_ae:b4:00 (6c:50:4d:ae:b4:00), Dst: Dell_d7:8b:2a (98:90:96:d7:8b:2a)
Internet Protocol Version 4, Src: 141.22.28.254, Dst: 141.22.27.100
Transmission Control Protocol, Src Port: 80, Dst Port: 20, Seq: 1, Ack: 17, Len: 480
    Source Port: 80
    Destination Port: 20
    [Stream index: 3]
    [TCP Segment Len: 480]
    Sequence number: 1    (relative sequence number)
    [Next sequence number: 481    (relative sequence number)]
    Acknowledgment number: 17    (relative ack number)
    0101 .... = Header Length: 20 bytes (5)
    Flags: 0x018 (PSH, ACK)
    Window size value: 29200
    [Calculated window size: 29200]
    [Window size scaling factor: -2 (no window scaling used)]
    Checksum: 0xa146 [unverified]
    [Checksum Status: Unverified]
    Urgent pointer: 0
    [SEQ/ACK analysis]
        [iRTT: 23.228919655 seconds]
        [Bytes in flight: 480]
        [Bytes sent since last PSH flag: 480]
    [Timestamps]
    TCP payload (480 bytes)
Hypertext Transfer Protocol
Line-based text data: text/html (8 lines)

No.     Time           Source                Destination           Protocol Length Info
    397 41.301104621   141.22.28.254         141.22.27.100         TCP      60     80 → 20 [FIN, ACK] Seq=481 Ack=17 Win=29200 Len=0

Frame 397: 60 bytes on wire (480 bits), 60 bytes captured (480 bits) on interface 0
Ethernet II, Src: Cisco_ae:b4:00 (6c:50:4d:ae:b4:00), Dst: Dell_d7:8b:2a (98:90:96:d7:8b:2a)
Internet Protocol Version 4, Src: 141.22.28.254, Dst: 141.22.27.100
Transmission Control Protocol, Src Port: 80, Dst Port: 20, Seq: 481, Ack: 17, Len: 0
    Source Port: 80
    Destination Port: 20
    [Stream index: 3]
    [TCP Segment Len: 0]
    Sequence number: 481    (relative sequence number)
    [Next sequence number: 481    (relative sequence number)]
    Acknowledgment number: 17    (relative ack number)
    0101 .... = Header Length: 20 bytes (5)
    Flags: 0x011 (FIN, ACK)
    Window size value: 29200
    [Calculated window size: 29200]
    [Window size scaling factor: -2 (no window scaling used)]
    Checksum: 0xe4a9 [unverified]
    [Checksum Status: Unverified]
    Urgent pointer: 0
    [Timestamps]

No.     Time           Source                Destination           Protocol Length Info
    497 54.455660626   141.22.28.254         141.22.27.100         TCP      534    [TCP Out-Of-Order] 80 → 20 [FIN, PSH, ACK] Seq=1 Ack=17 Win=29200 Len=480

Frame 497: 534 bytes on wire (4272 bits), 534 bytes captured (4272 bits) on interface 0
Ethernet II, Src: Cisco_ae:b4:00 (6c:50:4d:ae:b4:00), Dst: Dell_d7:8b:2a (98:90:96:d7:8b:2a)
Internet Protocol Version 4, Src: 141.22.28.254, Dst: 141.22.27.100
Transmission Control Protocol, Src Port: 80, Dst Port: 20, Seq: 1, Ack: 17, Len: 480
    Source Port: 80
    Destination Port: 20
    [Stream index: 3]
    [TCP Segment Len: 480]
    Sequence number: 1    (relative sequence number)
    [Next sequence number: 482    (relative sequence number)]
    Acknowledgment number: 17    (relative ack number)
    0101 .... = Header Length: 20 bytes (5)
    Flags: 0x019 (FIN, PSH, ACK)
    Window size value: 29200
    [Calculated window size: 29200]
    [Window size scaling factor: -2 (no window scaling used)]
    Checksum: 0xa145 [unverified]
    [Checksum Status: Unverified]
    Urgent pointer: 0
    [SEQ/ACK analysis]
        [iRTT: 23.228919655 seconds]
        [Bytes in flight: 481]
        [Bytes sent since last PSH flag: 480]
        [TCP Analysis Flags]
            [Expert Info (Warning/Sequence): This frame is a (suspected) out-of-order segment]
    [Timestamps]
    TCP payload (480 bytes)

No.     Time           Source                Destination           Protocol Length Info
    663 80.791571367   141.22.28.254         141.22.27.100         TCP      534    [TCP Retransmission] 80 → 20 [FIN, PSH, ACK] Seq=1 Ack=17 Win=29200 Len=480

Frame 663: 534 bytes on wire (4272 bits), 534 bytes captured (4272 bits) on interface 0
Ethernet II, Src: Cisco_ae:b4:00 (6c:50:4d:ae:b4:00), Dst: Dell_d7:8b:2a (98:90:96:d7:8b:2a)
Internet Protocol Version 4, Src: 141.22.28.254, Dst: 141.22.27.100
Transmission Control Protocol, Src Port: 80, Dst Port: 20, Seq: 1, Ack: 17, Len: 480
    Source Port: 80
    Destination Port: 20
    [Stream index: 3]
    [TCP Segment Len: 480]
    Sequence number: 1    (relative sequence number)
    [Next sequence number: 482    (relative sequence number)]
    Acknowledgment number: 17    (relative ack number)
    0101 .... = Header Length: 20 bytes (5)
    Flags: 0x019 (FIN, PSH, ACK)
    Window size value: 29200
    [Calculated window size: 29200]
    [Window size scaling factor: -2 (no window scaling used)]
    Checksum: 0xa145 [unverified]
    [Checksum Status: Unverified]
    Urgent pointer: 0
    [SEQ/ACK analysis]
        [iRTT: 23.228919655 seconds]
        [Bytes in flight: 481]
        [Bytes sent since last PSH flag: 480]
        [TCP Analysis Flags]
            [Expert Info (Note/Sequence): This frame is a (suspected) retransmission]
            [The RTO for this segment was: 39.490466746 seconds]
            [RTO based on delta from frame: 397]
    [Timestamps]
    TCP payload (480 bytes)
    Retransmitted TCP segment data (480 bytes)
